Line Item,Report Period,Metric Type,Line Item Period,Low,High,Unit,Source Sentence
Total cash returned to shareholders,2022 Q4,retrospective,2022,46,None,usd,"And finally, we returned $12.4 billion to shareholders, up 19% year over year through share repurchases and dividends, bringing our total cash returned to shareholders to over $46 billion for the full fiscal year."
Depreciable useful life for server and network equipment assets,2022 Q4,guidance,FY 2023,4,6,number,"First, effective at the start of FY '23, we are extending the depreciable useful life for server and network equipment assets in our cloud infrastructure from four to six years"
Operating income impact,2022 Q4,guidance,FY 2023,3.7,None,currency,"As a result, based on the outstanding balances as of June 30, we expect fiscal year '23 operating income to be favorably impacted by approximately $3.7 billion for the full fiscal year"
Operating income impact,2022 Q4,guidance,Q1 2023,1.1,None,currency,"As a result, based on the outstanding balances as of June 30, we expect fiscal year '23 operating income to be favorably impacted by approximately $1.1 billion in the first quarter."
Line Item Name,2022 Q4,Statement,Period,Low,High,unit,Source Sentence
FX Impact,2022 Q4,Guidance,FY 2022,4,None,percentage,"Assuming current rates remain stable, we expect a roughly four-point impact to full-year revenue growth with headwinds in H1 greater than in H2."
COGS and operating expense growth decrease,2022 Q4,guidance,Q4 2022,2,None,percentage,FX should also decrease COGS and operating expense growth by two points.
Line Item Name,2022 Q4,Statement Type,Period,Low,High,unit,Source Sentence
Revenue Growth,2022 Q4,Guidance,FY 2022,10,None,percentage,We continue to expect double-digit revenue and operating income growth in both constant currency and U.S. dollars.
Operating Income Growth,2022 Q4,Guidance,FY 2022,10,None,percentage,We continue to expect double-digit revenue and operating income growth in both constant currency and U.S. dollars.
Operating expense growth,2022 Q4,guidance,FY '23,None,None,percentage,"Operating expense growth will be significant early in FY '23 and will moderate materially over the course of the year as we slow the rate of hiring to focus on key growth areas, increase the productivity of prior year headcount investments and anniversary the Nuance and Xandr acquisitions."
Operating margins,2022 Q4,guidance,FY '23,None,None,percentage,"we expect operating margins based on constant currency to be approximately flat year over year in FY '23, excluding the benefit from the latest change in useful life."
FY '23 full-year margins,2022 Q4,guidance,FY '23,None,None,percentage,"And in U.S. dollars, we expect FY '23 full-year margins to be roughly flat as the useful life benefit is mostly offset by the FX headwind mentioned earlier."
Effective tax rate,2022 Q4,guidance,FY '23,19,None,percentage,"And finally, we expect our FY '23 effective tax rate to be roughly 19%."
Line Item,2022 Q4,Statement,Period,Low,High,unit,Source Sentence
FX impact on total revenue growth,2022 Q4,guidance,Q1 2022,-5,None,percentage,"With the stronger U.S. dollar and based on current rates, we expect FX to decrease total revenue growth by approximately five points"
FX impact on total COGS and operating expense growth,2022 Q4,guidance,Q1 2022,-3,None,percentage,"With the stronger U.S. dollar and based on current rates, we expect FX to decrease total COGS and operating expense growth by approximately three points"
FX impact on revenue growth in Productivity and Business Processes and Intelligent Cloud,2022 Q4,guidance,Q1 2022,-6,None,percentage,"Within the segments, we anticipate roughly six points of negative FX impact on revenue growth in Productivity and Business Processes and Intelligent Cloud"
FX impact on revenue growth in More Personal Computing,2022 Q4,guidance,Q1 2022,-3,None,percentage,"Within the segments, we anticipate roughly six points of negative FX impact on revenue growth in Productivity and Business Processes and Intelligent Cloud and three points in More Personal Computing."
Microsoft Cloud gross margin percentage,2022 Q4,guidance,FY 2022,2,None,percentage,"Microsoft Cloud gross margin percentage should be up roughly two points year over year, driven by the latest accounting estimate change noted earlier."
Q1 gross margin percentage,2022 Q4,guidance,Q1 2022,-1,None,percentage,"Excluding the impact of the change in accounting estimate, Q1 gross margin percentage will decrease roughly one point, driven by revenue mix shift to Azure and the impact from the Nuance acquisition, partially offset by continued margin improvement in Azure."
Capital expenditures,2022 Q4,guidance,Q1 2022,None,None,currency,"In capital expenditures, we expect a sequential decrease on a dollar basis, with normal quarterly spend variability and the timing of our cloud infrastructure build-out."
Productivity and Business Processes Revenue Growth,2022 Q4,guidance,Q4 2022,12,14,percentage,"In Productivity and Business Processes, we expect revenue to grow between 12% and 14% in constant currency"
Productivity and Business Processes Revenue,2022 Q4,guidance,Q4 2022,15.95,16.25,currency,"In Productivity and Business Processes, we expect revenue to grow between 12% and 14% in constant currency or $15.95 billion to $16.25 billion."
Office 365 Revenue Growth,2022 Q4,guidance,Q4 2022,None,-2,percentage,We expect Office 365 revenue growth to be sequentially lower by roughly two points on a constant currency basis with a bit more FX impact on U.S. dollar growth than at the segment level.
On-premises business revenue decline,2022 Q4,guidance,Q4 2022,30,None,percentage,"In our on-premises business, on a prior year comparable, which benefited from contracts with higher in-period revenue recognition, we expect revenue to decline in the mid- to high 30s."
Office consumer revenue growth,2022 Q4,guidance,Q4 2022,None,None,percentage,"In Office consumer, we expect revenue to grow in the low to mid-single digits, driven by Microsoft 365 subscriptions."
LinkedIn revenue growth,2022 Q4,guidance,Q4 2022,None,None,percentage,"For LinkedIn, we expect continued strong engagement on the platform, although results will be impacted by the slowdown in advertising spend and hiring, resulting in low to mid-teens rev growth."
Dynamics revenue growth,2022 Q4,guidance,Q4 2022,None,None,percentage,"And in Dynamics, we expect revenue growth in the mid- to high teens, driven by share growth in Dynamics 365.."
Intelligent Cloud Revenue Growth,2022 Q4,guidance,Q4 2022,25,27,percentage,"For Intelligent Cloud, we expect revenue to grow between 25% and 27% in constant currency"
Intelligent Cloud Revenue,2022 Q4,guidance,Q4 2022,20.3,20.6,currency,"For Intelligent Cloud, we expect revenue to grow between 25% and 27% in constant currency or $20.3 billion to $20.6 billion."
Azure Revenue Growth,2022 Q4,guidance,Q4 2022,-3,None,percentage,We expect Azure revenue growth to be sequentially lower by roughly three points on a constant currency basis.
On-premises server business revenue,2022 Q4,guidance,Q4 2022,low single digits,None,percentage,"In our on-premises server business, we expect revenue to decline low single digits, driven by strong demand for our hybrid offerings offset by the prior year comparable, which included benefit from contracts with higher in-period revenue recognition."
Enterprise Services revenue growth,2022 Q4,guidance,Q4 2022,low single digits,None,percentage,"At Enterprise Services, we expect revenue growth to be in the low single digits, driven by enterprise support, partially offset by declines in Microsoft Consulting Services."
More Personal Computing revenue growth,2022 Q4,guidance,Q4 2022,1,4,percentage,"In More Personal Computing, we expect revenue to grow between 1% and 4% in constant currency."
More Personal Computing revenue,2022 Q4,guidance,Q4 2022,13,13.4,currency,"In More Personal Computing, we expect revenue to grow between 1% and 4% in constant currency or $13 billion to $13.4 billion."
Windows OEM revenue,2022 Q4,guidance,Q4 2022,high single digits,None,percentage,"In Windows OEM, we expect revenue to decline in the high single digits."
Line Item,2022 Q4,Statement,Period,Low,High,unit,Source Sentence
Windows 11 revenue deferral,2022 Q4,Guidance,FY 2022,None,None,percentage,"Excluding the impact from the Windows 11 revenue deferral last year, revenue would decline mid-teens, reflecting continued weakness in the PC market."
Windows commercial products and cloud services revenue,2022 Q4,Guidance,FY 2022,None,None,percentage,"In Windows commercial products and cloud services, customer demand for Microsoft 365 and our advanced security solutions should drive growth in the high single digits."
Surface revenue,2022 Q4,Guidance,FY 2022,None,None,percentage,"In Surface, revenue should decline in the low single digits."
Search and news advertising ex TAC revenue,2022 Q4,Guidance,FY 2022,None,None,percentage,"Search and news advertising ex TAC should grow in the mid- to high teens, roughly 10 points faster than the overall search and news advertising revenue, driven by growing first-party revenue and the inclusion of Xandr.."
Gaming Revenue Decline,2022 Q4,Guidance,Q4 2022,Low Single Digits,Mid Single Digits,percentage,"And in gaming, we expect revenue to decline in the low to mid-single digits, driven by declines in first-party content, partially offset by growth in Game Pass subscribers and consoles."
Xbox Content and Services Revenue Decline,2022 Q4,Guidance,Q4 2022,Low Single Digits,Mid Single Digits,percentage,We expect Xbox content and services revenue to decline in the low to mid-single digits.
COGS Growth,2022 Q4,Guidance,Q4 2022,12,14,percentage,We expect COGS to grow between 12% and 14% in constant currency.
COGS,2022 Q4,Guidance,Q4 2022,14.9,15.1,currency,or to be between $14.9 billion and $15.1 billion.
Operating Expense Growth,2022 Q4,Guidance,Q4 2022,19,20,percentage,and operating expense to grow between 19% and 20% in constant currency.
Operating Expense,2022 Q4,Guidance,Q4 2022,13.3,13.4,currency,or to be between $13.3 billion and $13.4 billion.
Total company headcount,2022 Q4,guidance,Q1 2022,11000,None,number,"Total company headcount is expected to continue to grow, with 11,000 hires expected to start in Q1, primarily in cloud engineering, LinkedIn, customer deployment, and commercial sales."
Q1 effective tax rate,2022 Q4,guidance,Q1 2022,19,None,percentage,And we expect our Q1 effective tax rate to be approximately 19%.
Q1 cash flow tax payments,2022 Q4,Retrospective,Q1 2022,3.2,None,currency,"Finally, as a reminder on Q1 cash flow, we will be making $3.2 billion of tax payments related to the TCJA transition tax and the transfer of intangible property completed in Q1 of FY '22."
Triple-digit growth in Cosmos DB,2022 Q4,retrospective,Q4 2022,100,None,percentage,One is the triple-digit growth in Cosmos DB
Triple-digit growth in container app services,2022 Q4,retrospective,Q4 2022,100,None,percentage,and triple-digit growth in container app services.
"First, of course, if we're talking about USD would be FX",2022 Q4,Guidance,H1,None,None,currency,"First, of course, if we're talking about USD would be FX, it's a bigger headwind in H1, it's less of a headwind in H2."
"First, of course, if we're talking about USD would be FX",2022 Q4,Guidance,H2,None,None,currency,"First, of course, if we're talking about USD would be FX, it's a bigger headwind in H1, it's less of a headwind in H2."
Headcount,2022 Q4,Retrospective,Q4 2022,22,None,percentage,"As we've talked about in H1, we've obviously added 22% headcount this quarter."
Hires,2022 Q4,Guidance,Q1 2022,11000,None,number,"We still have 11,000 hires that we have starting in Q1.."
Azure constant currency growth,2022 Q4,guidance,Q3 2022,43,None,percentage,"Amy, you and Satya talked about very robust large new deal activity. I thought your guidance for Azure constant currency growth in the September quarter of a three-point decel to 43 is fairly solid."
Consumption Deceleration,2022 Q4,Guidance,Q1 2022,3,None,percentage,It does assume continued consumption deceleration of three points quarter to quarter.
Microsoft 365 user growth,2022 Q4,retrospective,Q4 2022,14,None,percentage,"Yes. Maybe I'll just start and Amy, you can add. I mean, the two numbers that our usage -- our user growth numbers, right, the 14% growth in the number of seats of Microsoft 365 and then the E5 growth of 60%, I think, speak to, again, that best-of-suite value in the core and in E5. So we're very, very competitive on both of those.."
E5 growth,2022 Q4,retrospective,Q4 2022,60,None,percentage,"Yes. Maybe I'll just start and Amy, you can add. I mean, the two numbers that our usage -- our user growth numbers, right, the 14% growth in the number of seats of Microsoft 365 and then the E5 growth of 60%, I think, speak to, again, that best-of-suite value in the core and in E5. So we're very, very competitive on both of those.."
